qid	Human	Raw-T5	Rewritten-T5
1003	What are the differences between dental crowns and veneers?	"I have a larger chip, how do the options different for repairing it?"	"I have a larger chip, how do the options different for my dentist?"
1004	How does an implant compare to a crown?	What about using an implant to fix a chip?	What about using an implant?
1005	Which one of dental implants or crowns is more expensive?	Which is more expensive?	Which one is more expensive?
1006	What is the coverage of the crown in insurance?	What is the coverage of the crown in insurance?	What is the coverage of the crown in insurance?
1007	What is the coverage of the crown in medicare?	I meant medicare	I meant medicare?
1008	Show me medicare dentists in Seattle	Show me covered dentists in Seattle	Show me covered dentists in Seattle?
1011	What is Melania Trump's religion?	What is Melania Trump's religion?	What is Melania Trump's religion?
1012	What did Melania Trump do before she was married?	What did Melania Trump do before she was married?	What did Melania Trump do before she was married?
1013	Does Melania Trump have children?	Does Melania Trump have children?	Does Melania Trump have children?
1014	How old is Barron Trump?	How old is Donald Trump?	How old is Donald Trump?
1015	Donald and Melania Trump met at the Kit Kat Club?  Where is the Kit Kat Club?	Where is the Kit Kat Club where Melania Trump and Donald Trump met?	Where is the Kit Kat Club where Melania Trump met Donald Trump?
1016	When did Melania Trump become a model?	When did Melania Trump become a model?	When did Melania Trump become a model?
1017	Does the public pay the First Lady of the United States?	Do we pay Melania Trump as First Lady?	Do we pay Melania Trump?
1018	Does the public pay Ivanka Trump?	What about Ivanka Trump?	What about Ivanka Trump?
1019	Does the public pay Jared Kushner?	And Jared Trump?	And Jared?
10110	What does Jared Kushner do at the White House?	What does Jared Rosholt do at the White House?	What does Jared Rosholt do at the White House?
1021	When did social security start in the United States (US)?	When did social security start in the US?	When did social security start in the US?
1022	Was social security mandatory?	Was Social Security mandatory in the United States?	Was Social Security mandatory in the US?
1023	Who received the first social security check?	Who received the first Social Security check?	Who received the first check for Social Security in the US?
1024	When did the government start borrowing from social security?	When did the government start borrowing from Social Security checks?	When did the US government start borrowing from Social Security?
1025	How much money is owed to social security?	How much is owed by Social Security?	How much is owed by Social Security?
1026	When will social security run out of money?	When will the Social Security Administration run out of money?	When will Social Security run out of money?
1027	Wow! What will happen if social security runs out of money?	Wow! What will happen to the Social Security Trust Fund?	Wow! What will happen to Social Security?
1028	Can social security be fixed?	Can Social Security checks be fixed?	Can Social Security's withdrawal from the Social Security check be fixed?
1029	How much of a tax increase will keep social security solvent?	How much of an increase is there in Social Security?	How much of an increase is there in Social Security?
1031	Why were the Grateful Dead such an influential live band?	Why were the Dead such an influential live band?	Why were the Dead such an influential live band?
1032	Why did the Grateful Dead allow live recordings?	Why did Dave and the Dead allow live recordings?	Why did the Dead allow live recordings?
1033	Did the Grateful Dead have a number one hit?	Did the Grateful Dead have a #1 hit?	Did the Dead have a #1 hit?
1034	Who was the leader of the Grateful Dead?	Who was the leader of Scarface?	Who was the leader of the Dead?
1035	How did Jerry Garcia lose his finger?	How did Jerry Garcia lose his finger?	"How did Jerome John ""Jerry"" Garcia lose his finger?"
1036	What was Jerry Garcia's relationship to Jefferson Airplane?	What was Raynaud's relationship to the Airplane?	"What was Jerome John ""Jerry"" Garcia's relationship to the Airplane?"
1038	Who wrote Cassidy?	"Who wrote the song, The Dead?"	Who wrote the song Cassidy on Stage (theatre)?
1039	What else did John Barlow and Bob Weir write?	What else did the Grateful Dead write besides Cassidy?	What else did the Dead write besides Cassidy?
10310	Why did the Grateful Dead break up?	Why did the band The Living End break up?	Why did the Dead break up?
1041	Who are some of the well-known Information Retrieval researchers?	Who are some of the well-known Information Retrieval researchers?	Who are some of the well-known Information Retrieval researchers?
1043	Who are some important British Information Retrieval researchers?	Who are some important British researchers in Information Retrieval?	Who are some important British Information Retrieval researchers?
1044	What did Cyril Cleverdon's studies contribute to the evaluation of Information Retrieval systems?	What did Cyril Cleverdon's studies contribute to evaluation?	What did Cyril Cleverdon's studies contribute to evaluation?
1046	How did the Cranfield Experiments influence modern information retrieval evaluation initiatives?	How did Brick and mortar business brick-and-mortar experiments influence modern initiatives?	How did Brick and mortar influence modern initiatives?
1047	What is TREC for information retrieval research?	What is TREC?	What is TREC?
1048	What are some recent TREC tasks?	What are some recent tasks of the Information Retrieval Research Centre?	What are some recent tasks for Information Retrieval?
1049	e-Discovery?  What's that?	What's e-Discovery? What's that?	What's e-Discovery?
10410	What are the important components of an information retrieval test collection?	What are the important components of a test collection?	What are the important components of a test collection?
10412	What are important evaluation measures for web search engines?	What are important measures for web search engines?	What are important measures for web search engines?
10413	What are important online evaluation metrics for web search?	What are the important metrics for online search engines?	What about online metrics?
1051	When did the Black Lives Matter campaign begin?	When did the Black Lives Matter campaign begin?	When did the Black Lives Matter campaign begin?
1052	Tell me more about the shooting of Trayvon Martin.	"Tell me more about what happened in Ferguson, Missouri with the Black Lives Matter movement"	"Tell me more about what happened in Ferguson, Missouri in 2014?"
1053	Why was George Zimmerman acquitted?	Why was Trayvon Martin acquitted of murder?	Why was George Zimmerman acquitted of murdering Trayvon Martin?
1054	And how what happened to Michael Brown?	And what happened to Brown in the Black Lives Matter campaign?	And how about what happened to Brown?
1055	"Who named the movement ""Black Lives Matter""?"	Who named the Black Lives Matter movement?	Who named the Black Lives Matter movement?
1056	What was the US reaction to the Black Lives Matter movement?	What was the US reaction to the Black Lives Matter campaign?	What was the US reaction to Black Lives Matter?
1057	Tell me more about the Blue Lives Matter movement.	Tell me more about the movement of the police supporters of the hashtag Blue Lives Matter	"Tell me more about the movement of the police supporters in Ferguson, Missouri?"
1058	Why were Rafael Ramos and Wenjian Liu killed?	Why were the NYPD officers killed in the 2014 killings of Wenjian Liu and Rafael Ramos?	Why were Rafael Ramos and Wenjian Liu killed?
1059	What else motivates the Black Lives Matter movement?	What else motivates the Black Lives Matter movement besides the #BlackLivesMatter hashtag?	What else motivates the Black Lives Matter movement?